topic,label,periodo,contagem,z,manchetes_evidencia
0,Processos disciplinares,2024-08-12,5,2.35,CNJ abre processo e afasta juiz baiano por uso de token e outras infrações | Juiz de São Paulo será investigado por descumprir decisões do STJ | Corregedoria Nacional aciona TJMA sobre suspeita de magistrados em organização criminosa
0,Processos disciplinares,2024-10-21,5,2.35,Magistrada da Justiça do Trabalho do RJ é punida com disponibilidade | Plenário aprova recomendação para identificar e prevenir a litigância abusiva | CNJ exclui oficiais distribuidores de audiência de escolha de serventias no Paraná
0,Processos disciplinares,2024-12-09,4,1.72,Desembargador mineiro acusado de conceder vantagem indevida é punido com pena de disponibilidade | Juiz do RJ tem pena agravada por faltas injustificadas e por delegar uso de token | Juiz mato-grossense responderá por suposta irregularidades em condução de inquérito policial
0,Processos disciplinares,2025-02-10,5,2.35,Juiz do RJ responderá a PAD por má gestão e baixa produtividade | Ratificado afastamento de delegatário de Caxias (MA) acusado de irregularidades na gestão de cartório | Plenário abre PAD contra desembargador do TJSP suspeito de venda de sentenças
0,Processos disciplinares,2025-03-24,4,1.72,Colegiado do CNJ aplica pena de disponibilidade a desembargadora do TJBA | Desembargador do MT acusado de receber vantagens indevidas responderá a PAD | CNJ declara nulo dispositivo de resolução do TJSC sobre parcelamento de precatórios
0,Processos disciplinares,2025-05-19,4,1.72,Juiz é afastado de função após reiterada negligência com prazos processuais | CNJ aplica pena de disponibilidade de dois anos a juiz acusado de agredir a esposa | Morosidade excessiva em vara de família leva CNJ a aplicar disponibilidade a juíza do Amazonas
0,Processos disciplinares,2025-08-04,4,1.72,Juiz de Mato Grosso é aposentado compulsoriamente por sonegação de tributos e falsidade ideológica | Desembargador do TJRS acusado de violência doméstica é aposentado compulsoriamente | Instaurado PAD contra desembargador do MT investigado por venda de sentença
0,Processos disciplinares,2025-11-10,4,1.72,Plenário abre PADs para investigar participação de 6 magistrados maranhenses em esquema de corrupção | Juiz baiano que manteve documentos judiciais em casa sem justificativa é aposentado compulsoriamente | Processo disciplinar vai apurar suposta venda de decisões por magistrado do TJMS
0,Processos disciplinares,2025-12-08,5,2.35,Corregedoria Nacional de Justiça afasta juiz da Bahia acusado de corrupção e lavagem de dinheiro | Juiz federal acusado de assédio sexual é aposentado compulsoriamente | Cartório criado para desacumular outra serventia só pode ser ocupado por meio de concurso
0,Processos disciplinares,2026-03-02,8,4.26,"Nota à imprensa: afastamento do desembargador Guaraci de Campos Vianna, do TJRJ | CNJ confirma pena máxima contra juiz por assédio e perseguição a servidoras | Desembargador mineiro acusado de crimes sexuais segue afastado das funções pelo CNJ"
0,Processos disciplinares,2026-03-16,4,1.72,CNJ abre processo para investigar manifestações agressivas e político-partidárias de desembargadora | Colegiado do CNJ determina abertura de PAD e mantém afastamento de desembargador do TRT-8 | Desembargador do TJSP é afastado por 180 dias após revisão disciplinar
1,Equidade racial,2024-11-04,4,2.81,Judiciário celebra cultura antirracista e premia iniciativas de equidade racial | Novo painel de dados do CNJ mostra panorama de processos de racismo no Brasil | Valorização da representatividade negra é o destaque da abertura de seminário no CNJ
1,Equidade racial,2025-09-22,4,2.81,CNJ destaca iniciativas premiadas na 2ª edição do Prêmio de Equidade Racial | CNJ apresenta Relatório de Gestão do Justiça Plural e destaca avanços em direitos humanos | Ministro Barroso destaca conquistas à frente do CNJ em dois anos de gestão
1,Equidade racial,2025-11-17,7,5.53,Publicações ampliam o olhar do Judiciário sobre desigualdades raciais | Consciência Negra: Justiça Militar gaúcha promove blitz para discutir microagressões raciais | Tribunal do PI abre Semana da Consciência Negra com lançamento de cartilha sobre crimes raciais
2,Violência doméstica / mulheres,2024-08-05,5,2.67,Integração dos fluxos de proteção orientam enunciados aprovados na XVIII Jornada Maria da Penha | Políticas de combate à violência contra mulheres marca história do CNJ | Violência doméstica: proposta de nova lei deve ampliar direitos e proteção das mulheres
2,Violência doméstica / mulheres,2024-11-25,4,1.97,Tribunais ampliam proteção a mulheres ao julgar casos de violência doméstica e feminicídio | 21 Dias de Ativismo: tribunais promovem ações para conscientizar estudantes sobre violência doméstica | Início do mutirão de audiências marca a abertura da 28ª Semana Justiça pela Paz em Casa no Acre
2,Violência doméstica / mulheres,2025-02-17,6,3.38,"Entrega de Pontos de Inclusão Digital encerra ação para meninas e mulheres em Marajó (PA) | “Combater a violência no Marajó tem sido prioridade para a Justiça”, diz conselheira, em Breves (PA) | Itinerância em Bagre (PA) fortalece rede de proteção de meninas e mulheres"
2,Violência doméstica / mulheres,2025-03-10,4,1.97,Semana da Justiça pela Paz em Casa: tribunal fluminense terá 1.449 audiências | CNJ 20 anos: Justiça garante efetividade ao combate à violência contra mulheres | Justiça do Trabalho catarinense realiza ações de conscientização contra violência doméstica
2,Violência doméstica / mulheres,2025-08-18,5,2.67,Presidente do STF e do CNJ participa de ação para combater a violência contra mulheres e meninas na Ilha do Marajó (PA) | Avaliação de Risco: webinário reforça compromisso de enfrentamento à violência contra a mulher | Violência contra a mulher: Justiça acreana sensibiliza jovens sobre relacionamentos abusivos
2,Violência doméstica / mulheres,2025-11-17,4,1.97,"CNJ assina acordos nesta segunda (24/11) para ampliar combate à violência contra mulheres | 21 dias de ativismo: com foco no combate à violência digital, ação começa nesta quinta (20/11) | Tribunal do Amazonas pauta 2.152 audiências para Semana Justiça pela Paz em Casa"
2,Violência doméstica / mulheres,2025-12-08,4,1.97,"Justiça voltada ao enfrentamento da violência contra a mulher e à defesa da infância | Em Afuá (PA), rede de acolhimento para meninas e mulheres recebe apoio e escuta do CNJ | Corregedoria Nacional firma acordo que reforça combate à violência de gênero"
2,Violência doméstica / mulheres,2026-02-02,4,1.97,Combate à violência contra a mulher indígena é tema de seminário no Maranhão | Três Poderes da República se unem em pacto para enfrentamento ao feminicídio no Brasil | CGJ emite recomendação sobre monitoramento eletrônico em casos de violência doméstica
3,Conciliação e mediação,2024-11-11,7,4.19,"Justiça do Trabalho do Paraná ajusta acordos em R$ 61,4 mi durante a Semana da Conciliação | Semana da Conciliação: Justiça do Trabalho da Bahia movimenta R$ 68,9 milhões em acordos | Tribunal do Tocantins homologa mais de R$5 milhões em acordos na Semana da Conciliação"
3,Conciliação e mediação,2025-06-02,4,2.07,Tribunal de Campinas arrecada R$ 297 mi e é campeão da Semana da Conciliação Trabalhista | Tribunais de Minas Gerais se unem para solucionar conflitos fundiários | Semana da Conciliação Trabalhista: Tribunal da 11.ª Região movimenta mais de R$ 20 milhões
3,Conciliação e mediação,2025-11-03,6,3.49,Central de Conciliação de São Paulo realiza 770 audiências durante a XX Semana da Conciliação | Mutirão de conciliação ajuda regularização de contas de energia em atraso em Roraima | Semana da Conciliação no Pará é iniciada com inauguração de Cejusc
3,Conciliação e mediação,2026-01-19,4,2.07,Cooperação favorece julgamentos do Tribunal do Júri em Paracatu | Mediação pré-processual: TRT-11 oferece solução rápida e gratuita para conflitos | TJMG retoma mutirão de ações ligadas ao rompimento da Barragem do Fundão
4,IA / Justiça 4.0,2024-09-23,7,5.27,"Debates e propostas devem atualizar normas sobre o uso de IA no Judiciário | Audiência pública trata sobre riscos, mecanismos e custos associados ao uso de IA no Judiciário | Transformação digital do CNJ é impulsionada na gestão Barroso"
4,IA / Justiça 4.0,2025-09-29,4,2.67,IA generativa é utilizada em mais de 45% dos tribunais brasileiros | Comitê Nacional do CNJ vai supervisionar uso de IA no Judiciário | Inscrições para o I Encontro Nacional de Encarregadas e Encarregados de Dados do Poder Judiciário vão até 8/10
6,Justiça Itinerante / cidadania,2024-11-18,4,2.67,Programa Solo Seguro regulariza mais de 22 mil títulos na Amazônia Legal | Teatro Amazonas sedia abertura 2.ª Semana Nacional de Regularização Fundiária | Mutirão da Justiça do Trabalho leva dignidade para pessoas em situação de rua de Manaus
6,Justiça Itinerante / cidadania,2025-06-23,5,3.58,Observatório dos Direitos Humanos do Judiciário debate proteção socioambiental e atuação judicial em Xapuri/AC | Ministro Barroso estará em Xapuri/AC para encerramento da Justiça Itinerante Cooperativa da Amazônia Legal | Justiça Itinerante: equipe conhece principais demandas de território indígena no Amazonas
6,Justiça Itinerante / cidadania,2025-11-03,4,2.67,Semana da Conciliação: Cejusc-Cível destaca-se ao realizar mais de 4 mil audiências no Amazonas | Semana Nacional da Conciliação mobiliza comarcas do interior do Amazonas | Justiça Itinerante: programa leva serviços e fortalece a cidadania em Niquelândia (GO)
6,Justiça Itinerante / cidadania,2026-04-20,4,2.67,Registre-se PopRuaJud: mais de 14 mil atendimentos foram realizados no Rio | Justiça Itinerante: iniciativa do CNJ amplia acesso a serviços no Marajó em parceria com mais de 50 instituições | Justiça Eleitoral em PE participa do PopRuaJud 2026
8,Participação feminina,2025-03-17,4,4.48,Trajetória das mulheres no Judiciário é tema de mostra no Museu do tribunal catarinense | Reunião de ouvidorias da Justiça do Trabalho debate transparência e participação social | Equidade de Gênero: Justiça Federal da 5.ª Região vota lista tríplice exclusiva para juízas
9,Direitos humanos / Corte IDH,2025-09-29,6,4.46,"37 anos da Constituição: fotografias mostram olhar do Judiciário para direitos constitucionais | CNJ recebe Rafael Sales Pimenta e apresenta estratégias em prol de defensores de direitos humanos | Com ampliação do acesso à Justiça, Constituição fortaleceu a cidadania no Brasil"
9,Direitos humanos / Corte IDH,2025-10-20,5,3.61,Estudo inédito mapeia estruturas voltadas aos direitos humanos do Judiciário | Justiça brasileira intensifica alinhamento ao Sistema Interamericano de Direitos Humanos | Acordo impulsionará capacitação para internalizar Convenção Americana de Direitos Humanos no Brasil
9,Direitos humanos / Corte IDH,2025-11-17,4,2.76,"Na Costa Rica, presidente do CNJ explica experiência brasileira na superação de ataques às instituições | Fachin destaca papel da advocacia para a defesa da democracia constitucional | Presidente do CNJ recebe OEA para tratar de direitos humanos e democracia no continente americano"
9,Direitos humanos / Corte IDH,2026-03-16,4,2.76,Corte Interamericana inicia atividades no Brasil com sessão de abertura no STF | Novo Estatuto orienta magistratura brasileira à luz do Sistema Interamericano de Direitos Humanos | Juízes brasileiros e da Corte IDH conversam sobre compatibilidade das leis nacionais com obrigações internacionais
10,Institucional / Gestão,2024-08-26,5,2.84,"I Jornada de Boas Práticas em Tutelas Coletivas começa na segunda-feira (2/9) | PopRuaJud: em Recife, Comitê Nacional inicia atividades de projeto por moradia adequada | Ministro Barroso realiza palestra para estudantes do ensino médio em Santa Catarina"
10,Institucional / Gestão,2024-10-14,4,2.07,"Ministro Barroso acompanha aplicação de provas do 2.º Enam | Com proposta integradora, Academia Nacional de Polícia Judicial encerra ciclo de capacitação | Justiça paulista instala unidades e amplia atendimento em Complexo Criminal"
10,Institucional / Gestão,2024-11-11,4,2.07,"Comitê Pop Rua/Jus mineiro realiza encontro sobre egressos em situação de rua | Encontro Nacional impulsiona tecnologia, comunicação e sustentabilidade no Judiciário | CNJ e Enfam concluem primeira turma de curso sobre sistema socioeducativo"
10,Institucional / Gestão,2025-03-10,5,2.84,Justiça Eleitoral e Enfam firmam acordo para aperfeiçoamento de juízes eleitorais | Policiais judiciais do Tribunal Federal da 4.ª Região iniciam curso para proteção de autoridades | Tribunal do Maranhão sediará Encontro Nacional sobre Litigiosidade Responsável no Judiciário
10,Institucional / Gestão,2025-05-12,4,2.07,"Justiça mais próxima, transparente, inclusiva e acessível será debatida por profissionais de comunicação do Judiciário | Inscrições para o Prêmio Nacional de Comunicação e Justiça terminam nesta sexta-feira (16/5) | Judiciário goiano realiza audiência pública sobre metas nacionais do CNJ"
10,Institucional / Gestão,2025-09-29,4,2.07,Presidente do CNJ recebe representantes de associações da magistratura nacional | Ministro Edson Fachin se reúne com conselheiros do CNJ em primeiro dia da gestão | II Jornada de Boas Práticas em Tutelas Coletivas acontece nesta quinta-feira (2/10)
10,Institucional / Gestão,2026-05-04,4,2.07,Justiça Federal na Paraíba sediará curso sobre cooperação jurídica internacional | CNJ promove 1ª Reunião Preparatória do 20º Encontro Nacional do Judiciário | Profissionais de comunicação do Judiciário se reúnem em Brasília para encontro nacional
13,LGBTQIA+,2024-06-24,5,4.8,Transgeneridades Negras: tribunal baiano promove mostra de temas do universo LGBTQIAPN+ | CNJ traduz para inglês e espanhol publicações sobre pessoas LGBTQIAPN+ em conflito com a lei | Abertas inscrições para curso sobre identidade de gênero no Judiciário
13,LGBTQIA+,2025-06-23,5,4.8,Evento do CNJ pauta desafios e oportunidades para a inclusão efetiva de pessoas LGBTQIA+ | CNJ e parceiros discutem medidas para enfrentar violações contra população LGBTQIA+ | LGBTQIA+: encontro debate acesso à Justiça e letramento em gênero nas polícias e no Judiciário
14,Sistema prisional,2024-12-23,4,2.29,Bibliotecas do Tribunal Superior Eleitoral contam com acervo histórico e obras raras | Campanha de tribunal do DF arrecada roupas e sapatos para egressos do sistema prisional | Ano foi marcado por construção de plano para enfrentar situação inconstitucional nas prisões
14,Sistema prisional,2025-05-05,6,3.97,Judiciário maranhense promove ações de acesso à leitura no sistema socioeducativo | Pena Justa é apresentado em preparatória para o 19.º Encontro do Poder Judiciário | Judiciário e Executivo de AL apostam em tecnologia para incentivar a leitura de reeducandos
14,Sistema prisional,2025-08-04,4,2.29,Projeto Mentes Literárias lança obras de detentos em presídios de Santa Catarina | Roraima formaliza adesão ao plano Pena Justa para transformar a política penal | Tribunal e Governo da Paraíba encaminha plano estadual Pena Justa ao STF
14,Sistema prisional,2025-10-27,4,2.29,"Em visita a penitenciária feminina, presidente do CNJ destaca respeito à dignidade e ações para reintegração social | Ministro Fachin acompanha conclusão de projeto para adesão de SP ao SEEU | Tribunal do Amapá faz inspeção em unidades prisionais para verificar condição de habitabilidade"
14,Sistema prisional,2026-04-06,4,2.29,"Projeto do CNJ leva cultura a presídios e mira reinserção social | Segundo dia da Semana de Cultura articula trabalho, formação e acesso à leitura no RJ | Primeiro dia da Semana de Cultura leva música e arte a unidades prisionais do RJ"
14,Sistema prisional,2026-05-18,4,2.29,Pena Justa avança com trabalho e educação durante itinerância em Marajó | Pena Justa impulsiona vagas de trabalho para pessoas presas e egressas no Mato Grosso | STJ entrega a bibliotecas do Pará seis mil livros arrecadados no Programa Esperança Garcia
15,Inclusão PCDs,2024-09-16,6,6.86,Inclusão de pessoas com deficiência é pauta no Judiciário do Rio Grande do Norte | Uso da linguagem simples nas audiências propicia acesso à Justiça por PcDs | Tecnologias assistivas estão na mira dos direitos das pessoas com deficiência
16,Inovação,2024-09-09,9,7.06,"Na Bahia, ministro Barroso analisa cenário jurídico nacional com avanço da tecnologia | Prêmio reconhece sete práticas inovadoras idealizadas e implementadas pelo Judiciário | 4.º FestLabs: práticas sustentáveis, inovadoras e de impacto social aprimoram a Justiça"
16,Inovação,2025-05-05,4,2.77,Oficina sobre inovação transforma visão de magistrados e servidores do Judiciário do MT | Inovação e colaboração marcam o 1.º FestLabs da Região Sul | CNJ lança capacitação sobre o Domicílio Judicial Eletrônico para pessoa física
16,Inovação,2025-06-09,4,2.77,Evento fortalece redes de inovação em tribunais do Centro-Oeste | Caravana Conecta reúne soluções inovadoras do Centro-Oeste em Cuiabá | BNMP 3.0: inscrições abertas para capacitação autoinstrucional
17,Regularização fundiária,2026-05-25,4,4.84,Solo Seguro — Favela e Comunidades entrega títulos em Ponte Alta do Bom Jesus | Solo Seguro entrega títulos de moradia a famílias em Chapada dos Guimarães | Solo Seguro — Favela: corregedor nacional entrega títulos de imóveis no Rio de Janeiro
20,Linguagem simples,2024-07-29,4,5.58,Linguagem simples: Portal da Justiça do Trabalho goiana traduz expressões jurídicas | Justiça Eleitoral de Rondônia firma pacto coletivo pelo uso da linguagem simples | Justiça do Trabalho gaúcha lança campanha para incentivar uso da linguagem simples
21,Saúde / judicialização,2025-11-03,4,3.93,"Diagnóstico do CNJ aponta alto índice de deferimento de pedidos em saúde e baixa conciliação | Soluções inovadoras em saúde são premiadas durante Congresso do Fonajus | Congresso do Fonajus: Judiciário está pronto para assegurar direito à saúde, afirma conselheira"
22,ENAC / Exame de cartórios,2026-06-08,4,5.28,Corregedoria Nacional e TJs acompanham 3º Exame Nacional dos Cartórios em todo o país | Nota da Corregedoria Nacional de Justiça | Corregedor nacional de Justiça acompanha 3ª edição do Enac na capital paraibana
23,Sustentabilidade / Pauta verde,2025-08-18,5,3.9,Semana da Pauta Verde: tribunal de Rondônia prioriza mais de 400 processos ambientais | Tribunal goiano promove Semana da Pauta Verde com foco na agilidade processual | Semana da Pauta Verde no Amapá: acordo histórico viabiliza solução do lixão de Oiapoque
23,Sustentabilidade / Pauta verde,2025-11-10,8,6.53,CNJ formaliza acordo com Universidade Federal do Pará para atuação na Amazônia | Presidente do CNJ defende ações concretas da Justiça para enfrentar emergência climática | COP30: magistratura brasileira declara compromisso com a justiça climática
28,Infância e juventude,2026-05-18,4,4.37,Justiça do DF promove seminário sobre prevenção da violência contra crianças e adolescentes | Mês da Infância Protegida: Como denunciar violência contra crianças e adolescentes | Judiciário e Defensoria Pública definem medidas para proteger órfãos do feminicídio
